{
  "$schema": "https://json-schema.org/draft/2020-12/schema",
  "type": "object",
  "properties": {
    "clip2": { "$ref": "#/$defs/grade" },
    "clip3": { "$ref": "#/$defs/grade" },
    "clip5": { "$ref": "#/$defs/grade" },
    "clip4": { "$ref": "#/$defs/grade" },
    "clip6": { "$ref": "#/$defs/grade" }
  },
  "$defs": {
    "grade": {
      "type": "object",
      "properties": {
        "gradeTemperature": { "type": "number", "minimum": -1, "maximum": 1, "multipleOf": 0.01 },
        "gradeContrast": { "type": "number", "minimum": -1, "maximum": 1, "multipleOf": 0.01 },
        "gradeSaturation": { "type": "number", "minimum": 0, "maximum": 2, "multipleOf": 0.01 },
        "gradeVignette": { "type": "number", "minimum": 0, "maximum": 1, "multipleOf": 0.01 }
      }
    }
  }
}
